{
  "benchmark_id": "terminal-bench-2.0",
  "id": "antirez-deepseek-v4-gguf-deepseek-v4-flash-iq2xxs-w2q2k-aprojq8-sexpq8-outq8-chat-v2-gguf-laguna-10017--iq2xxs--terminal-bench-2.0",
  "inherited_from": {
    "benchmark_run_id": "deepseek-ai-deepseek-v4-flash--2-bit-experts-vllm-moet-w2-fp8-kv--terminal-bench-2.0",
    "model_id": "deepseek-v4-flash",
    "source_model_instance_id": "deepseek-ai-deepseek-v4-flash--2-bit-experts-vllm-moet-w2-fp8-kv",
    "source_model_repository": "deepseek-ai/DeepSeek-V4-Flash"
  },
  "model_id": "deepseek-v4-flash",
  "model_instance_id": "antirez-deepseek-v4-gguf-deepseek-v4-flash-iq2xxs-w2q2k-aprojq8-sexpq8-outq8-chat-v2-gguf-laguna-10017--iq2xxs",
  "protocol": {
    "details": "Protocol details were not structured in the source model card; compare only with runs that cite the same source.",
    "name": "Terminal-Bench 2.0",
    "shots": null,
    "split": null,
    "version": null
  },
  "provenance": {
    "captured_at": "2026-08-27T21:11:10Z",
    "sources": [
      {
        "captured_at": "2026-08-27T21:11:10Z",
        "commit": "056ca18b649468d9721d080bd80049cdbecec542",
        "kind": "model-card-index",
        "url": "https://github.com/0xSero/hf-model-benchmarks"
      },
      {
        "captured_at": "2026-08-27T21:11:10Z",
        "kind": "model-card",
        "url": "https://huggingface.co/deepseek-ai/DeepSeek-V4-Flash"
      }
    ]
  },
  "schema_version": "local-ai-registry/v1",
  "score": {
    "higher_is_better": true,
    "metric": "reported_score",
    "unit": "points",
    "value": 65.4
  },
  "score_origin": "inherited",
  "source": {
    "captured_at": "2026-08-27T21:11:10Z",
    "kind": "model-card",
    "reported_model": "deepseek-ai/DeepSeek-V4-Flash",
    "url": "https://huggingface.co/deepseek-ai/DeepSeek-V4-Flash"
  }
}
