{
  "benchmark_id": "chatbot-arena",
  "id": "mimo-v2-flash-iq2xxs--iq2xxs--chatbot-arena",
  "inherited_from": {
    "benchmark_run_id": "unsloth-mimo-v2-flash-gguf--ud-iq1-m--chatbot-arena",
    "model_id": "mimo-v2-flash",
    "source_model_instance_id": "unsloth-mimo-v2-flash-gguf--ud-iq1-m",
    "source_model_repository": "XiaomiMiMo/MiMo-V2-Flash"
  },
  "model_id": "mimo-v2-flash",
  "model_instance_id": "mimo-v2-flash-iq2xxs--iq2xxs",
  "protocol": {
    "details": "Protocol details were not structured in the source model card; compare only with runs that cite the same source.",
    "name": "Chatbot Arena",
    "shots": null,
    "split": null,
    "version": null
  },
  "provenance": {
    "captured_at": "2026-08-27T21:11:10Z",
    "sources": [
      {
        "captured_at": "2026-08-27T21:11:10Z",
        "commit": "056ca18b649468d9721d080bd80049cdbecec542",
        "kind": "model-card-index",
        "url": "https://github.com/0xSero/hf-model-benchmarks"
      },
      {
        "captured_at": "2026-08-27T21:11:10Z",
        "kind": "model-card",
        "url": "https://huggingface.co/unsloth/MiMo-V2-Flash-GGUF"
      }
    ]
  },
  "schema_version": "local-ai-registry/v1",
  "score": {
    "higher_is_better": true,
    "metric": "reported_score",
    "unit": "points",
    "value": 86.2
  },
  "score_origin": "inherited",
  "source": {
    "captured_at": "2026-08-27T21:11:10Z",
    "kind": "model-card",
    "reported_model": "unsloth/MiMo-V2-Flash-GGUF",
    "url": "https://huggingface.co/unsloth/MiMo-V2-Flash-GGUF"
  }
}
