{
  "benchmark_id": "hellaswag",
  "id": "deepseek-ai-deepseek-v4-flash--2-bit-experts-vllm-moet-w2-fp8-kv--hellaswag",
  "inherited_from": null,
  "model_id": "deepseek-v4-flash",
  "model_instance_id": "deepseek-ai-deepseek-v4-flash--2-bit-experts-vllm-moet-w2-fp8-kv",
  "protocol": {
    "details": "Protocol details were not structured in the source model card; compare only with runs that cite the same source.",
    "name": "HellaSwag",
    "shots": null,
    "split": null,
    "version": null
  },
  "provenance": {
    "captured_at": "2026-08-27T21:11:10Z",
    "sources": [
      {
        "captured_at": "2026-08-27T21:11:10Z",
        "commit": "056ca18b649468d9721d080bd80049cdbecec542",
        "kind": "model-card-index",
        "url": "https://github.com/0xSero/hf-model-benchmarks"
      },
      {
        "captured_at": "2026-08-27T21:11:10Z",
        "kind": "model-card",
        "url": "https://huggingface.co/deepseek-ai/DeepSeek-V4-Flash"
      }
    ]
  },
  "schema_version": "local-ai-registry/v1",
  "score": {
    "higher_is_better": true,
    "metric": "reported_score",
    "unit": "points",
    "value": 86.4
  },
  "score_origin": "direct",
  "source": {
    "captured_at": "2026-08-27T21:11:10Z",
    "kind": "model-card",
    "reported_model": "deepseek-ai/DeepSeek-V4-Flash",
    "url": "https://huggingface.co/deepseek-ai/DeepSeek-V4-Flash"
  }
}
