{
  "benchmark_id": "gpqa",
  "id": "brooooooklyn-qwen3-6-35b-a3b-ud-q8-k-xl-mlx--q8-k-xl--gpqa",
  "inherited_from": {
    "benchmark_run_id": "unsloth-qwen3-6-35b-a3b-nvfp4--nvfp4--gpqa",
    "model_id": "qwen3-6-35b-a3b",
    "source_model_instance_id": "unsloth-qwen3-6-35b-a3b-nvfp4--nvfp4",
    "source_model_repository": "Qwen/Qwen3.6-35B-A3B"
  },
  "model_id": "qwen3-6-35b-a3b",
  "model_instance_id": "brooooooklyn-qwen3-6-35b-a3b-ud-q8-k-xl-mlx--q8-k-xl",
  "protocol": {
    "details": "Protocol details were not structured in the source model card; compare only with runs that cite the same source.",
    "name": "GPQA",
    "shots": null,
    "split": null,
    "version": null
  },
  "provenance": {
    "captured_at": "2026-08-27T21:11:10Z",
    "sources": [
      {
        "captured_at": "2026-08-27T21:11:10Z",
        "commit": "056ca18b649468d9721d080bd80049cdbecec542",
        "kind": "model-card-index",
        "url": "https://github.com/0xSero/hf-model-benchmarks"
      },
      {
        "captured_at": "2026-08-27T21:11:10Z",
        "kind": "model-card",
        "url": "https://huggingface.co/unsloth/Qwen3.6-35B-A3B-NVFP4"
      }
    ]
  },
  "schema_version": "local-ai-registry/v1",
  "score": {
    "higher_is_better": true,
    "metric": "reported_score",
    "unit": "points",
    "value": 86.74
  },
  "score_origin": "inherited",
  "source": {
    "captured_at": "2026-08-27T21:11:10Z",
    "kind": "model-card",
    "reported_model": "unsloth/Qwen3.6-35B-A3B-NVFP4",
    "url": "https://huggingface.co/unsloth/Qwen3.6-35B-A3B-NVFP4"
  }
}
