{
  "benchmark_id": "aime-2026",
  "id": "liquidai-lfm2-5-8b-a1b-mlx-4bit--4bit--aime-2026",
  "inherited_from": {
    "benchmark_run_id": "unsloth-lfm2-5-8b-a1b--iq4-xs--aime-2026",
    "model_id": "lfm2-5-8b-a1b",
    "source_model_instance_id": "unsloth-lfm2-5-8b-a1b--iq4-xs",
    "source_model_repository": "LiquidAI/LFM2.5-8B-A1B"
  },
  "model_id": "lfm2-5-8b-a1b",
  "model_instance_id": "liquidai-lfm2-5-8b-a1b-mlx-4bit--4bit",
  "protocol": {
    "details": "Protocol details were not structured in the source model card; compare only with runs that cite the same source.",
    "name": "AIME 2026",
    "shots": null,
    "split": null,
    "version": null
  },
  "provenance": {
    "captured_at": "2026-08-27T21:11:10Z",
    "sources": [
      {
        "captured_at": "2026-08-27T21:11:10Z",
        "commit": "056ca18b649468d9721d080bd80049cdbecec542",
        "kind": "model-card-index",
        "url": "https://github.com/0xSero/hf-model-benchmarks"
      },
      {
        "captured_at": "2026-08-27T21:11:10Z",
        "kind": "model-card",
        "url": "https://huggingface.co/unsloth/LFM2.5-8B-A1B"
      }
    ]
  },
  "schema_version": "local-ai-registry/v1",
  "score": {
    "higher_is_better": true,
    "metric": "reported_score",
    "unit": "points",
    "value": 50.0
  },
  "score_origin": "inherited",
  "source": {
    "captured_at": "2026-08-27T21:11:10Z",
    "kind": "model-card",
    "reported_model": "unsloth/LFM2.5-8B-A1B",
    "url": "https://huggingface.co/unsloth/LFM2.5-8B-A1B"
  }
}
