{
  "benchmark_id": "mmlu-pro",
  "id": "google-gemma-4-12b-it--bf16--mmlu-pro",
  "inherited_from": {
    "benchmark_run_id": null,
    "model_id": "gemma-4-12b",
    "source_model_instance_id": null,
    "source_model_repository": "google/gemma-4-12B"
  },
  "model_id": "gemma-4-12b",
  "model_instance_id": "google-gemma-4-12b-it--bf16",
  "protocol": {
    "details": "Protocol details were not structured in the source model card; compare only with runs that cite the same source.",
    "name": "MMLU-Pro",
    "shots": null,
    "split": null,
    "version": null
  },
  "provenance": {
    "captured_at": "2026-08-27T21:11:10Z",
    "sources": [
      {
        "captured_at": "2026-08-27T21:11:10Z",
        "commit": "056ca18b649468d9721d080bd80049cdbecec542",
        "kind": "model-card-index",
        "url": "https://github.com/0xSero/hf-model-benchmarks"
      },
      {
        "captured_at": "2026-08-27T21:11:10Z",
        "kind": "model-card",
        "url": "https://huggingface.co/google/gemma-4-12B"
      }
    ]
  },
  "schema_version": "local-ai-registry/v1",
  "score": {
    "higher_is_better": true,
    "metric": "reported_score",
    "unit": "points",
    "value": 85.2
  },
  "score_origin": "inherited",
  "source": {
    "captured_at": "2026-08-27T21:11:10Z",
    "kind": "model-card",
    "reported_model": "google/gemma-4-12B",
    "url": "https://huggingface.co/google/gemma-4-12B"
  }
}
