{
  "benchmark_id": "aime-2026",
  "id": "avlp12-glm-5-2-alis-mlx-dynamic-2-56bpw--mlx-2-56bpw-dynamic--aime-2026",
  "inherited_from": {
    "benchmark_run_id": null,
    "model_id": "glm-5-2",
    "source_model_instance_id": null,
    "source_model_repository": "zai-org/GLM-5.2"
  },
  "model_id": "glm-5-2",
  "model_instance_id": "avlp12-glm-5-2-alis-mlx-dynamic-2-56bpw--mlx-2-56bpw-dynamic",
  "protocol": {
    "details": "Protocol details were not structured in the source model card; compare only with runs that cite the same source.",
    "name": "AIME 2026",
    "shots": null,
    "split": null,
    "version": null
  },
  "provenance": {
    "captured_at": "2026-08-27T21:11:10Z",
    "sources": [
      {
        "captured_at": "2026-08-27T21:11:10Z",
        "commit": "056ca18b649468d9721d080bd80049cdbecec542",
        "kind": "model-card-index",
        "url": "https://github.com/0xSero/hf-model-benchmarks"
      },
      {
        "captured_at": "2026-08-27T21:11:10Z",
        "kind": "model-card",
        "url": "https://huggingface.co/zai-org/GLM-5.2"
      }
    ]
  },
  "schema_version": "local-ai-registry/v1",
  "score": {
    "higher_is_better": true,
    "metric": "reported_score",
    "unit": "points",
    "value": 99.2
  },
  "score_origin": "inherited",
  "source": {
    "captured_at": "2026-08-27T21:11:10Z",
    "kind": "model-card",
    "reported_model": "zai-org/GLM-5.2",
    "url": "https://huggingface.co/zai-org/GLM-5.2"
  }
}
