{
  "benchmark_id": "mmlu-pro",
  "id": "nvidia-nvidia-nemotron-3-super-120b-a12b-nvfp4--nvfp4--mmlu-pro",
  "inherited_from": {
    "benchmark_run_id": "unsloth-nvidia-nemotron-3-super-120b-a12b-gguf--ud-q3-k-m--mmlu-pro",
    "model_id": "nvidia-nemotron-3-super-120b-a12b",
    "source_model_instance_id": "unsloth-nvidia-nemotron-3-super-120b-a12b-gguf--ud-q3-k-m",
    "source_model_repository": "nvidia/NVIDIA-Nemotron-3-Super-120B-A12B-BF16"
  },
  "model_id": "nvidia-nemotron-3-super-120b-a12b",
  "model_instance_id": "nvidia-nvidia-nemotron-3-super-120b-a12b-nvfp4--nvfp4",
  "protocol": {
    "details": "Protocol details were not structured in the source model card; compare only with runs that cite the same source.",
    "name": "MMLU-Pro",
    "shots": null,
    "split": null,
    "version": null
  },
  "provenance": {
    "captured_at": "2026-08-27T21:11:10Z",
    "sources": [
      {
        "captured_at": "2026-08-27T21:11:10Z",
        "commit": "056ca18b649468d9721d080bd80049cdbecec542",
        "kind": "model-card-index",
        "url": "https://github.com/0xSero/hf-model-benchmarks"
      },
      {
        "captured_at": "2026-08-27T21:11:10Z",
        "kind": "model-card",
        "url": "https://huggingface.co/unsloth/NVIDIA-Nemotron-3-Super-120B-A12B-GGUF"
      }
    ]
  },
  "schema_version": "local-ai-registry/v1",
  "score": {
    "higher_is_better": true,
    "metric": "reported_score",
    "unit": "points",
    "value": 83.73
  },
  "score_origin": "inherited",
  "source": {
    "captured_at": "2026-08-27T21:11:10Z",
    "kind": "model-card",
    "reported_model": "unsloth/NVIDIA-Nemotron-3-Super-120B-A12B-GGUF",
    "url": "https://huggingface.co/unsloth/NVIDIA-Nemotron-3-Super-120B-A12B-GGUF"
  }
}
